products/title;products/handle;products/body_html;products/vendor;products/product_type;products/tags/0;products/tags/1;products/images/1/src
2025-10-31T16:35:54+01:00;2025-10-31T16:35:50+01:00;2026-01-22T20:37:58+01:00;Primavera/Verano26;;5,6126E+13;Negro / XS;8,16285E+13
2025-10-31T16:39:33+01:00;2025-10-31T16:39:29+01:00;2026-01-22T20:37:58+01:00;Primavera/Verano26;;5,6126E+13;Beige / S;8,16285E+13
2026-01-09T14:10:34+01:00;2025-12-09T13:28:07+01:00;2026-01-22T20:37:58+01:00;Vestidos;;5,65863E+13;Azul marino / 42;8,25627E+13
Parka Harris Wharf London Capucha Light Tecnica Marino;parka-harris-wharf-london-capucha-light-tecnica-marino;<p>Parka con capucha y cordon en cintura ajustable, cremallera</p>;Abrigos Harris Wharf London;Ropa y accesorios;Abrigos y gabardinas de mujer;Primavera/Verano26;https://cdn.shopify.com/s/files/1/0654/2937/3183/files/7A1EE3DE-62A5-4F83-8622-EADAAD8737E3.jpg?v=1768990818
Chaqueta Harris Wharf London Trench Técnica Camel;chaqueta-harris-wharf-london-trench-lana-camel;<p>Chaqueta cruzada con botones tecnica.</p>;Abrigos Harris Wharf London;Ropa y accesorios;Abrigos y gabardinas de mujer;Primavera/Verano26;https://cdn.shopify.com/s/files/1/0654/2937/3183/files/B5644D51-D00E-4EFF-B40E-4A8B387F0BF8.jpg?v=1768923847
Chaqueta Harris Wharf London Trench Tecnica Marino;chaqueta-harris-wharf-london-trench-tecnica-marino;<p>Chaqueta cuzada tecnica con botones.</p>;Abrigos Harris Wharf London;Ropa y accesorios;Abrigos y gabardinas de mujer;Primavera/Verano26;https://cdn.shopify.com/s/files/1/0654/2937/3183/files/89C77811-D8DC-43A8-8CDA-3051B5EBCF65.jpg?v=1768923904
Chaqueta Harris Wharf London Trench Lana Roja;chaqueta-harris-wharf-london-trench-lana-roja;<p>Chaqueta cruzada con botones de lana.</p>;Abrigos Harris Wharf London;Ropa y accesorios;Abrigos y gabardinas de mujer;Primavera/Verano26;https://cdn.shopify.com/s/files/1/0654/2937/3183/files/5BE63146-E043-4CA2-9346-D33503BFDC44.jpg?v=1768990772
Chaqueta Harris Wharf London Trench Lana Vison;chaqueta-harris-wharf-london-trench-lana-vison;<p>Chaqueta cruzada con botones y de lana.</p>;Abrigos Harris Wharf London;Ropa y accesorios;Abrigos y gabardinas de mujer;Primavera/Verano26;https://cdn.shopify.com/s/files/1/0654/2937/3183/files/413FF42D-D9FD-4FA5-BCB6-CB31D8BE8C96.jpg?v=1768924052
Sneaker Ecoalf Strenk Caqui;sneaker-ecoalf-strenk-caqui;;ECOALF;Ropa y accesorios;Calzado;Primavera/Verano26;https://cdn.shopify.com/s/files/1/0654/2937/3183/files/90A3BE2A-7B70-499C-BE29-9D6F33E8CE50.jpg?v=1768316759
Sneaker Ecoalf Strenk Gris;sneaker-ecoalf-strenk-gris;;ECOALF;Ropa y accesorios;Calzado;Primavera/Verano26;https://cdn.shopify.com/s/files/1/0654/2937/3183/files/6CA102CE-7246-44AB-B168-57586258111F.jpg?v=1768317227
Blusa Liviana Conti Cruzada;blusa-liviana-conti-cruzada;<p>Blusa de popelin, elastica, cruzada y abrochada con un botón el el lado.</p>;Liviana Conti;Ropa y accesorios;Camisas y blusas de mujer;Primavera/Verano26;https://cdn.shopify.com/s/files/1/0654/2937/3183/files/1004F0FE-5B4D-4990-80C1-8FB5E44F7CD8.jpg?v=1765368867
Blazer Agoefilo Punto Milano;blazer-agoefilo-punto-milano;<p>Blazer de dos botones boolsillos delanteros a los lados,de punto milano elastica.</p>;Pantalones AGOeFILO;Ropa y accesorios;Chaquetas y americanas de mujer;Primavera/Verano26;
Blazer Harris Wharf London Frise Bicolor Denim;blazer-harris-wharf-london-frise-bicolor-denim;<p>Chaqueta con dos botones en tejido frise bicolor.</p>;Abrigos Harris Wharf London;Ropa y accesorios;Chaquetas y americanas de mujer;Primavera/Verano26;https://cdn.shopify.com/s/files/1/0654/2937/3183/files/75264009-C180-4999-A3AB-F04D80C66124.jpg?v=1768922485
Jersey Floor Cuello Pico;jersey-floor-cuello-pico;<p>Jersey cuello pico, manga larga, ancho.</p>;FLOOR;Ropa y accesorios;Otoño/Invierno 25;Punto y jersey de mujer;https://cdn.shopify.com/s/files/1/0654/2937/3183/files/D382E843-A6AB-454B-B017-3E7925548766.jpg?v=1763552291
Jersey Florr C.Redondo M.Francesa;jersey-florr-c-redondo-m-francesa;<p>Jersey 100% lana de cuello redondo, manga francesa.</p>;FLOOR;Ropa y accesorios;Otoño/Invierno 25;Punto y jersey de mujer;https://cdn.shopify.com/s/files/1/0654/2937/3183/files/F1E66A5C-1F4C-4D04-9B57-10B91F05EB37.jpg?v=1763553111
Jersey Floor C.Pico;jersey-floor-c-pico;<p>Jersey de lana, cuello pico, manga larga</p>;FLOOR;Ropa y accesorios;Otoño/Invierno 25;Punto y jersey de mujer;https://cdn.shopify.com/s/files/1/0654/2937/3183/files/E873D7C2-EFBE-4567-A2ED-7472F6AE1744.jpg?v=1763553142
Jersey Floor Cuello Cisne;jersey-floor-cuello-cisne;<p>Jersey de lana, cuello cisne, manga larga. </p>;FLOOR;Ropa y accesorios;Otoño/Invierno 25;Punto y jersey de mujer;https://cdn.shopify.com/s/files/1/0654/2937/3183/files/555B74B7-4FE9-4C08-8F41-C32E6913B73E.jpg?v=1763553179
Pantalon Il Baco Da Seta Ancho Vuelta;pantalon-il-baco-da-seta-ancho-vuelta;<p>Pantalon con goma en la cintura, ancho con vuelta, elastico.</p>;Il Baco Da Seta;Ropa y accesorios;Otoño/Invierno 25;Pantalones y vaqueros de mujer;https://cdn.shopify.com/s/files/1/0654/2937/3183/files/99B869FD-AE92-41F7-A505-E1AF5B481A4F.jpg?v=1763983741
 lo que los convierte en el accesorio perfecto para cualquier ocasión;" ya sea una reunión casual o una noche especial. Cada pieza es única y está diseñada para destacar tu personalidad y estilo único.</p>""";2025-10-31T13:00:04+01:00;Ropa y accesorios;collares;Otoño/Invierno 25;;
Vestido Il Baco Da Seta Saja Terciopelo Estampado Flores;vestido-parole-saja-terciopelo-estampado-flores;<p>vestido largo de terciopelo, manga larga, estampado flores</p>;ilbacodaseta;Ropa y accesorios;Otoño/Invierno 25;Vestido Otoño Invierno;https://cdn.shopify.com/s/files/1/0654/2937/3183/files/2778C605-A0E3-4E2A-899E-4E13D11C036D.jpg?v=1762350232
Pantalon Agoefilo Recto Punto Fino;pantalon-agoefilo-recto-punto-fino;<p>Pantalon de punto recto con cremallera al lado,elastico.</p>;Pantalones AGOeFILO;Ropa y accesorios;Pantalones y vaqueros de mujer;Primavera/Verano26;
Pantalon Agoefilo Campanita Flecos;pantalon-agoefilo-campanita-flecos;<p>Pantalon de algodon elastico campanita flecos.</p>;Pantalones AGOeFILO;Ropa y accesorios;Pantalones y vaqueros de mujer;Primavera/Verano26;https://cdn.shopify.com/s/files/1/0654/2937/3183/files/99FBE9BC-A9C0-41DD-B8C0-B8EFD0C68D56.jpg?v=1768990253
Pantalon Agoefilo Campanita Punto Milano;pantalon-agoefilo-recto-punto;<p>Pantalon con cremallera  con bolsillos pequena campana y elastico.</p>;Pantalones AGOeFILO;Ropa y accesorios;Pantalones y vaqueros de mujer;Primavera/Verano26;
Pantalon Agoefilo Ancho Strech;pantalon-agoefilo-flare-flecos;<p>Pantalon elastico ancho con bolsillos traseros.</p>;Pantalones AGOeFILO;Ropa y accesorios;Pantalones y vaqueros de mujer;Primavera/Verano26;https://cdn.shopify.com/s/files/1/0654/2937/3183/files/969914E3-E789-4564-AC5A-ABDF71516915.jpg?v=1768990460
Pantalón Cambio Cameron;pantalon-cambio-cameron-1;<p>Pantalon elastico, con goma en la cintura, ancho corto.</p>;Pantalones Cambio;Ropa y accesorios;Pantalones y vaqueros de mujer;Primavera/Verano26;https://cdn.shopify.com/s/files/1/0654/2937/3183/files/26496A7A-8E3E-42A3-9FC1-A0F88FBED94E.jpg?v=1768481669
Jeans Cambio Tess Pocket Cropped;jeans-cambio-tess-pocket-cropped;<p>Jeans recto, con bolsillos de plastón delantero, elastico.</p>;Pantalones Cambio;Ropa y accesorios;Pantalones y vaqueros de mujer;Primavera/Verano26;https://cdn.shopify.com/s/files/1/0654/2937/3183/files/C381ACC7-5654-4F88-937B-823EA0F8AADD.jpg?v=1768481621
Jeans Cambio Elin;jeans-cambio-elin;<p>Jeans, elastico, 5 bolisllos, con pinza en el camal.</p>;Pantalones Cambio;Ropa y accesorios;Pantalones y vaqueros de mujer;Primavera/Verano26;https://cdn.shopify.com/s/files/1/0654/2937/3183/files/B5259201-9098-4105-A63A-CFFD96D367BC.jpg?v=1768481718
Jeans Cambio Francesca Azul;jeans-cambio-francesca-azul-1;<p>Jeans elastico, recto, 5 bolsillos.</p>;Pantalones Cambio;Ropa y accesorios;Pantalones y vaqueros de mujer;Primavera/Verano26;https://cdn.shopify.com/s/files/1/0654/2937/3183/files/E7F9A86D-0012-418F-9C01-3894B023D715.jpg?v=1766504330
Pantalon Cambio Elena;pantalon-cambio-elena;<p>Pantalon elastico, regular fit, con goma el la cintura.</p>;Pantalones Cambio;Ropa y accesorios;Pantalones y vaqueros de mujer;Primavera/Verano26;https://cdn.shopify.com/s/files/1/0654/2937/3183/files/923540EB-2CDC-4897-912C-CB702B18BDB3.jpg?v=1768388788
Pantalon Liviana Conti Recto;pantalon-liviana-conti-recto;<p>Pantalon tipo punto roma, recto, con goma detras.</p>;Liviana Conti;Ropa y accesorios;Pantalones y vaqueros de mujer;Primavera/Verano26;https://cdn.shopify.com/s/files/1/0654/2937/3183/files/A331CEE4-BAC3-4DD1-9948-C9BF67A9E4B9.jpg?v=1765544283
Pantalon Liviana Conti Popelin Flare;pantalon-liviana-conti-popelin-flare;<p>Pantalon de popelin, flare, con goma en la cintura.</p>;Liviana Conti;Ropa y accesorios;Pantalones y vaqueros de mujer;Primavera/Verano26;https://cdn.shopify.com/s/files/1/0654/2937/3183/files/DD379E4A-777A-4608-AFD8-0F6B50C75853.jpg?v=1765369027
Chaqueta Harris Wharf London Trench Lana Crema;chaqueta-harris-wharf-london-trench-lana-crema;<p>Chaqueta  cruzada con botones de lana.</p>;Abrigos Harris Wharf London;Ropa y accesorios;Primavera/Verano26;;https://cdn.shopify.com/s/files/1/0654/2937/3183/files/CD25CE10-BE5D-4D34-B032-60A362433887.jpg?v=1768923989
Sneaker Ecoalf Denver Chocolate;sneaker-ecoalf-denver-chocolate;"<p data-start=""142"" data-end=""300"">Descubre el equilibrio perfecto entre estilo urbano y compromiso sostenible con las Denver Chocolate de Ecoalf. Elegancia consciente sin renunciar al conf</p>";;;;;
Sneakers Ecoalf Denver Blanco;sneakers-ecoalf-denver-blanco;"<p data-start=""142"" data-end=""300"">Descubre el equilibrio perfecto entre estilo urbano y compromiso sostenible con las Denver Blanco de Ecoalf. Elegancia consciente sin renunciar al conf</p>";;;;;
Pantalon Liviana Conti Punto Flare;pantalon-liviana-conti-punto-flare-1;"<ul data-start=""450"" data-end=""1171"">";;;;;
Cazadora Liviana Conti Raglan;cazadora-liviana-conti-raglan;<ul>;;;;;
Sneaker Ecoalf Condeknit Sand;sneaker-ecoalf-condeknit-sand;<p>Sneaker ecologica.</p>;ilbacodaseta;;;;https://cdn.shopify.com/s/files/1/0654/2937/3183/files/43416610-5A70-41DB-9292-557334D91D82.jpg?v=1763379024
Collar Marcantelli Fabrizio Fino Cara Celeste;collar-marcantelli-fabrizio-fino-cara-celeste;"<p data-start=""288"" data-end=""720"">Descubre el encanto atemporal del <strong data-start=""322"" data-end=""364"">Collar Fabrizio Marcantelli Fino Cara</strong>, una pieza sofisticada y versátil que realza cualquier atuendo con audacia y delicadeza. Su diseño de miméticas mini cuentas negras complementadas por elegantes enganches dorados y un colgante en forma de cara aporta un contraste refinado y moderno, ideal tanto para el día a día como para ocasiones especiales.</p>";;;;;
Blazer Sissi Otto Style Art A Porter Kimono;blazer-sissi-otto-style-art-a-porter-kimono;"<ul data-start=""295"" data-end=""1470"">";;;;;
